{
  "schema_version": "dsh-task-cleaner/quarantine/v1alpha1",
  "quarantine_id": "44444444-4444-4444-8444-444444444444",
  "task_id": "task-001",
  "run_id": "run-001",
  "manifest_id": "11111111-1111-4111-8111-111111111111",
  "decision_id": "decision-001",
  "created_at": "2026-09-09T00:00:00Z",
  "status": "quarantined",
  "entries": [
    {
      "entry_id": "55555555-5555-4555-8555-555555555555",
      "candidate_id": "cand-001",
      "source_rel_path": "out/gen/tmp-123.txt",
      "source_real_path": "/workspace/out/gen/tmp-123.txt",
      "quarantine_rel_path": "44444444-4444-4444-8444-444444444444/tmp-123.txt",
      "kind": "file",
      "identity": {
        "dev": "1",
        "ino": "2",
        "nlink": 1,
        "ctime": "2026-09-09T00:00:00Z"
      },
      "sha256_before": "dddddddddddddddddddddddddddddddddddddddddddddddddddddddddddddddd",
      "size_bytes": 12,
      "mtime": "2026-09-09T00:00:00Z",
      "mode": "0644",
      "git_status": {
        "tracked": false,
        "head": false,
        "index": false
      },
      "symlink_target": null,
      "state": "verified"
    }
  ]
}
